{
  "schemaVersion": "kindergrimm-research/0.2",
  "generator": {
    "name": "kindergrimm",
    "source": "albertobeiz/kindergrimm",
    "upstreamCommit": "de339ad739d8cbd28ff2dd4a940af38c0ede86c8",
    "license": "Unlicense / public domain dedication",
    "representation": "procedural 2D Canvas parts composed as CanvasTexture planes",
    "runtime": "browser-local JavaScript + Canvas 2D + Three.js/WebGL",
    "runtimeLlmCalls": 0,
    "cloudApiCalls": 0
  },
  "batch": {
    "id": "batch-240824-mosslight-waystation",
    "input": {
      "seed": 240824,
      "count": 12,
      "color": "color",
      "species": "all",
      "media": "all"
    },
    "count": 12,
    "unique": 12,
    "deterministicOrder": true
  },
  "spritesheet": {
    "tileSize": 256,
    "columns": 4,
    "rows": 3,
    "width": 1024,
    "height": 768,
    "background": "transparent",
    "order": "row-major"
  },
  "assets": [
    {
      "id": "npc-e4bdc857",
      "fingerprint": "e4bdc857",
      "batchIndex": 0,
      "representation": "procedural-2d-canvas-texture",
      "recipe": {
        "seed": 233143426,
        "species": "dog",
        "base": "quad",
        "color": "color",
        "media": "watercolor",
        "parts": {
          "tail": {
            "params": {
              "style": "curl",
              "len": 1.0793336858507245,
              "side": 1
            }
          },
          "legs": {
            "params": {
              "style": "wide",
              "len": 0.614843541290611,
              "foot": "mitten"
            }
          },
          "torso": {
            "params": {
              "shape": "barrel",
              "wF": 0.5092253678152338,
              "hF": 0.5392821108549833,
              "lean": -0.05018727307207882,
              "pattern": "buttons",
              "clothOn": true,
              "clothIdx": 2,
              "tone": "light"
            }
          },
          "arms": {
            "params": {
              "style": "stub",
              "len": 0.5775213843211532,
              "droop": 0.7687344853999093,
              "asym": -0.16645516120363027,
              "hand": "dot"
            }
          },
          "wings": {
            "params": {
              "style": "folded",
              "len": 0.955403009406291,
              "feathers": 4
            }
          },
          "paws": {
            "params": {
              "front": "oval",
              "spread": 0.9664284507511183,
              "toes": false
            }
          },
          "quadlegs": {
            "params": {
              "thick": 1.1052143814973534,
              "toes": true,
              "back": true
            }
          },
          "offhand": {
            "params": {
              "family": "none",
              "rank": "inked",
              "seed": 619479332
            }
          },
          "held": {
            "params": {
              "family": "none",
              "rank": "sketch",
              "seed": 504395005
            }
          },
          "hair": {
            "params": {
              "style": "bald",
              "tone": "stipple",
              "colOn": true,
              "colIdx": 3,
              "bang": "none",
              "bangN": 6,
              "cpart": false,
              "longZig": false,
              "longNt": 5,
              "flare": 1.1910145755996928,
              "fall": 0.8477769242133946,
              "spikyN": 13,
              "bunsTop": true,
              "afroR": 1.2465041579585523,
              "mohawkN": 8,
              "tailUp": true
            }
          },
          "crest": {
            "params": {
              "style": "floppy",
              "tone": "skin",
              "len": 2.1095449300017206,
              "curve": 0.1592206452973186,
              "spread": 1.0695049743354321,
              "tilt": 0.3518698500469328,
              "earAsym": -0.025943225631490346,
              "nSpikes": 7,
              "branches": 2
            }
          },
          "skull": {
            "params": {
              "s": 0.3769183094985783,
              "wf": 0.8152930662035942,
              "turn": 0.08936023381538691,
              "shroud": false,
              "round": 0.861661526390817,
              "shape": "round",
              "muzzle": 0.2649909946881235,
              "muzzleY": 0.734308792417869,
              "fur": true,
              "jaw": 0.9773441588389687,
              "chinW": 0.9008305307477713,
              "skullY": 0.892919643339701,
              "chinY": 0.7270288730971515,
              "press": 1.3655312227085235,
              "shade": "none",
              "hollows": false,
              "construction": false,
              "darkSkin": true,
              "plain": true,
              "skinOn": false,
              "skinIdx": 7,
              "skinScrib": false
            }
          },
          "ears": {
            "params": {
              "rings": true,
              "nRings": 2
            }
          },
          "eyes": {
            "params": {
              "type": "happy",
              "type2": "saucer",
              "scaleR": 1.2340920601505787,
              "scale": 0.9018364536575972,
              "ehJit": 1.0353025080636145,
              "fierce": 0.48219078374095276,
              "gazeJit": -0.04188691987656057,
              "sx": 0.5106495563918725,
              "sink": 0.7771884722053073,
              "lashes": false,
              "glint": true
            }
          },
          "brows": {
            "params": {
              "on": false,
              "a": 0.12206853698007766,
              "thF": 0.04492348212003708,
              "yF": 0.11674680560827255
            }
          },
          "nose": {
            "params": {
              "style": "button",
              "nostril": true,
              "size": 1.7873069270979614,
              "snoutLen": 0.9658731305971742,
              "snoutFat": 0.9695363115286455,
              "snoutTip": 0.047390328617766514
            }
          },
          "mouth": {
            "params": {
              "style": "tongue",
              "myF": 0.47106667567044497,
              "wF": 1.8942828854080291,
              "beakLen": 1.29002879797481,
              "upperLip": false,
              "crease": false,
              "nTeeth": 3,
              "nStitch": 3
            }
          },
          "extras": {
            "params": {
              "mark": "none",
              "mod": "none",
              "tears": false,
              "freckles": false,
              "spots": false,
              "whiskers": false,
              "studs": false,
              "bandage": false,
              "blush": true,
              "glasses": false,
              "antenna": false,
              "accentIdx": 1,
              "accidents": false,
              "smudge": true,
              "eraser": false
            }
          },
          "tearsWet": {
            "params": {
              "len": 0.8171658563893288,
              "wob": 1.175846951629501
            }
          },
          "worn": {
            "params": {
              "family": "none",
              "rank": "sketch",
              "seed": 465247774
            }
          }
        }
      },
      "visual": {
        "rendererId": "mosslight-canvas-decorator",
        "rendererVersion": "0.1.0",
        "rendererFingerprint": "2bd2c78e",
        "baseRenderer": "kindergrimm-drawn-2d",
        "addedParts": [
          "mosslight-halo",
          "mosslight-waymark",
          "mosslight-fireflies"
        ],
        "variant": {
          "paletteIndex": 0,
          "haloLeaves": 8,
          "waymark": "lamp",
          "fireflies": 4,
          "driftSide": 1
        },
        "fingerprint": "f666e685"
      }
    },
    {
      "id": "npc-a5b0cdfd",
      "fingerprint": "a5b0cdfd",
      "batchIndex": 1,
      "representation": "procedural-2d-canvas-texture",
      "recipe": {
        "seed": 249921045,
        "species": "human",
        "base": "biped",
        "color": "color",
        "media": "ink",
        "parts": {
          "tail": {
            "params": {
              "style": "none",
              "len": 1.03001705436036,
              "side": -1
            }
          },
          "legs": {
            "params": {
              "style": "stub",
              "len": 0.6391188643872737,
              "foot": "mitten"
            }
          },
          "torso": {
            "params": {
              "shape": "round",
              "wF": 0.4011564517533407,
              "hF": 0.6613131957501173,
              "lean": 0.02494252773933113,
              "pattern": "none",
              "clothOn": true,
              "clothIdx": 2,
              "tone": "light"
            }
          },
          "arms": {
            "params": {
              "style": "wing",
              "len": 0.7428708426654339,
              "droop": 0.7284124335623345,
              "asym": 0.1570972409984097,
              "hand": "dot"
            }
          },
          "wings": {
            "params": {
              "style": "folded",
              "len": 0.9238777735503391,
              "feathers": 3
            }
          },
          "paws": {
            "params": {
              "front": "oval",
              "spread": 0.8622291560284793,
              "toes": true
            }
          },
          "quadlegs": {
            "params": {
              "thick": 0.9914659940637648,
              "toes": true,
              "back": true
            }
          },
          "offhand": {
            "params": {
              "family": "none",
              "rank": "sketch",
              "seed": 637535790
            }
          },
          "held": {
            "params": {
              "family": "none",
              "rank": "inked",
              "seed": 400063920
            }
          },
          "hair": {
            "params": {